[
  {
    "id": "beedfc4e-c187-4b5c-a4a4-f3b474285a39",
    "title": "Refactor Data Pipeline (Day 1)",
    "type": "coding",
    "createdAt": 1789271100000,
    "completedAt": 1789274700000,
    "duration": 3600,
    "location": "Home Office",
    "priority": "high"
  },
  {
    "id": "b7a07206-7d53-4ee0-bdf5-69c676ea2bc3",
    "title": "Implement Unit Tests (Day 1)",
    "type": "coding",
    "createdAt": 1789275600000,
    "completedAt": 1789278300000,
    "duration": 2700,
    "location": "Home Office",
    "priority": "medium"
  },
  {
    "id": "bb6ff183-7484-4bbf-bb23-a508d6bb6517",
    "title": "Sprint Sync (Day 1)",
    "type": "meeting",
    "createdAt": 1789284600000,
    "completedAt": 1789286400000,
    "duration": 1800,
    "location": "Meeting Room",
    "priority": "medium"
  },
  {
    "id": "fa178447-8cfa-4f28-9d17-e86ca185103b",
    "title": "Draft Technical Proposal (Day 1)",
    "type": "writing",
    "createdAt": 1789293600000,
    "completedAt": null,
    "duration": 270,
    "location": "Cafe",
    "priority": "high"
  },
  {
    "id": "53d31934-fe7c-41cd-857c-bcd64ceb19be",
    "title": "Documentation Updates (Day 1)",
    "type": "writing",
    "createdAt": 1789298100000,
    "completedAt": null,
    "duration": 180,
    "location": "Cafe",
    "priority": "low"
  },
  {
    "id": "40a3464f-a087-4a66-96a4-093a2929b70b",
    "title": "Plan Tomorrow Goals (Day 1)",
    "type": "planning",
    "createdAt": 1789302600000,
    "completedAt": 1789303500000,
    "duration": 900,
    "location": "Home Office",
    "priority": "low"
  },
  {
    "id": "c255fd9b-13fa-41b3-b825-4375b8296b7b",
    "title": "Refactor Data Pipeline (Day 2)",
    "type": "coding",
    "createdAt": 1789357500000,
    "completedAt": 1789361100000,
    "duration": 3600,
    "location": "Home Office",
    "priority": "high"
  },
  {
    "id": "fdc0e481-aac7-4a7b-be0b-6a6903f7fcda",
    "title": "Implement Unit Tests (Day 2)",
    "type": "coding",
    "createdAt": 1789362000000,
    "completedAt": 1789364700000,
    "duration": 2700,
    "location": "Home Office",
    "priority": "medium"
  },
  {
    "id": "20556057-c4dc-439e-9f0c-bf415500b64d",
    "title": "Sprint Sync (Day 2)",
    "type": "meeting",
    "createdAt": 1789371000000,
    "completedAt": 1789372800000,
    "duration": 1800,
    "location": "Meeting Room",
    "priority": "medium"
  },
  {
    "id": "a7606d5f-fcac-4a50-8f98-13bb823fed5c",
    "title": "Draft Technical Proposal (Day 2)",
    "type": "writing",
    "createdAt": 1789380000000,
    "completedAt": null,
    "duration": 270,
    "location": "Cafe",
    "priority": "high"
  },
  {
    "id": "c2a46f74-ecff-449e-9052-194b56b089a2",
    "title": "Documentation Updates (Day 2)",
    "type": "writing",
    "createdAt": 1789384500000,
    "completedAt": null,
    "duration": 180,
    "location": "Cafe",
    "priority": "low"
  },
  {
    "id": "23b8d00e-3806-4739-888d-f21ca565ba49",
    "title": "Plan Tomorrow Goals (Day 2)",
    "type": "planning",
    "createdAt": 1789389000000,
    "completedAt": 1789389900000,
    "duration": 900,
    "location": "Home Office",
    "priority": "low"
  },
  {
    "id": "9578f3fc-8856-4093-adc8-a865c6341c33",
    "title": "Refactor Data Pipeline (Day 3)",
    "type": "coding",
    "createdAt": 1789443900000,
    "completedAt": 1789447500000,
    "duration": 3600,
    "location": "Home Office",
    "priority": "high"
  },
  {
    "id": "e2001fff-f808-420f-a6e4-27f467570a9c",
    "title": "Implement Unit Tests (Day 3)",
    "type": "coding",
    "createdAt": 1789448400000,
    "completedAt": 1789451100000,
    "duration": 2700,
    "location": "Home Office",
    "priority": "medium"
  },
  {
    "id": "3057a258-3e97-4e20-9a0e-87074cbcd4fe",
    "title": "Sprint Sync (Day 3)",
    "type": "meeting",
    "createdAt": 1789457400000,
    "completedAt": 1789459200000,
    "duration": 1800,
    "location": "Meeting Room",
    "priority": "medium"
  },
  {
    "id": "37093599-6b63-4386-92bb-3c1c49f21cbe",
    "title": "Draft Technical Proposal (Day 3)",
    "type": "writing",
    "createdAt": 1789466400000,
    "completedAt": null,
    "duration": 270,
    "location": "Cafe",
    "priority": "high"
  },
  {
    "id": "ce0a7c08-f0de-4497-ae03-5f55a589e877",
    "title": "Documentation Updates (Day 3)",
    "type": "writing",
    "createdAt": 1789470900000,
    "completedAt": null,
    "duration": 180,
    "location": "Cafe",
    "priority": "low"
  },
  {
    "id": "b16c41d7-7737-4dc2-8b6b-2b96deca1765",
    "title": "Plan Tomorrow Goals (Day 3)",
    "type": "planning",
    "createdAt": 1789475400000,
    "completedAt": 1789476300000,
    "duration": 900,
    "location": "Home Office",
    "priority": "low"
  },
  {
    "id": "8525893f-0c5a-497a-af8b-2f6c1871fd59",
    "title": "Refactor Data Pipeline (Day 4)",
    "type": "coding",
    "createdAt": 1789530300000,
    "completedAt": 1789533900000,
    "duration": 3600,
    "location": "Home Office",
    "priority": "high"
  },
  {
    "id": "80cc6da2-bb7c-4305-8e02-510785b4bbb8",
    "title": "Implement Unit Tests (Day 4)",
    "type": "coding",
    "createdAt": 1789534800000,
    "completedAt": 1789537500000,
    "duration": 2700,
    "location": "Home Office",
    "priority": "medium"
  },
  {
    "id": "fd9a988f-3825-4061-a368-91965a96134e",
    "title": "Sprint Sync (Day 4)",
    "type": "meeting",
    "createdAt": 1789543800000,
    "completedAt": 1789545600000,
    "duration": 1800,
    "location": "Meeting Room",
    "priority": "medium"
  },
  {
    "id": "21049815-7069-4ee9-a2d7-496003871761",
    "title": "Draft Technical Proposal (Day 4)",
    "type": "writing",
    "createdAt": 1789552800000,
    "completedAt": null,
    "duration": 270,
    "location": "Cafe",
    "priority": "high"
  },
  {
    "id": "0180c897-96da-4e7a-9ef8-78a2cece24ec",
    "title": "Documentation Updates (Day 4)",
    "type": "writing",
    "createdAt": 1789557300000,
    "completedAt": null,
    "duration": 180,
    "location": "Cafe",
    "priority": "low"
  },
  {
    "id": "0caaa124-7361-4f89-8358-bd398b66f694",
    "title": "Plan Tomorrow Goals (Day 4)",
    "type": "planning",
    "createdAt": 1789561800000,
    "completedAt": 1789562700000,
    "duration": 900,
    "location": "Home Office",
    "priority": "low"
  },
  {
    "id": "c60bd57f-35b9-42e8-bfa9-3acc985c17d2",
    "title": "Refactor Data Pipeline (Day 5)",
    "type": "coding",
    "createdAt": 1789616700000,
    "completedAt": 1789620300000,
    "duration": 3600,
    "location": "Home Office",
    "priority": "high"
  },
  {
    "id": "c143d16b-5225-437b-a871-a4eba38854d7",
    "title": "Implement Unit Tests (Day 5)",
    "type": "coding",
    "createdAt": 1789621200000,
    "completedAt": 1789623900000,
    "duration": 2700,
    "location": "Home Office",
    "priority": "medium"
  },
  {
    "id": "44d2400f-183c-4beb-9487-5e5a87eb6d39",
    "title": "Sprint Sync (Day 5)",
    "type": "meeting",
    "createdAt": 1789630200000,
    "completedAt": 1789632000000,
    "duration": 1800,
    "location": "Meeting Room",
    "priority": "medium"
  },
  {
    "id": "833a14e8-74f6-4540-a0b7-3af13b95c9a6",
    "title": "Draft Technical Proposal (Day 5)",
    "type": "writing",
    "createdAt": 1789639200000,
    "completedAt": null,
    "duration": 270,
    "location": "Cafe",
    "priority": "high"
  },
  {
    "id": "9bf69c23-9167-47d7-b4bd-2cebe914fc6d",
    "title": "Documentation Updates (Day 5)",
    "type": "writing",
    "createdAt": 1789643700000,
    "completedAt": null,
    "duration": 180,
    "location": "Cafe",
    "priority": "low"
  },
  {
    "id": "c8519058-21b9-44ca-93dc-0de79ba7792b",
    "title": "Plan Tomorrow Goals (Day 5)",
    "type": "planning",
    "createdAt": 1789648200000,
    "completedAt": 1789649100000,
    "duration": 900,
    "location": "Home Office",
    "priority": "low"
  },
  {
    "id": "d79b790a-1c5b-414b-999e-72324c4e15e0",
    "title": "Refactor Data Pipeline (Day 6)",
    "type": "coding",
    "createdAt": 1789703100000,
    "completedAt": 1789706700000,
    "duration": 3600,
    "location": "Home Office",
    "priority": "high"
  },
  {
    "id": "6248e45a-963f-4ffa-bf1f-a78448ce93c5",
    "title": "Implement Unit Tests (Day 6)",
    "type": "coding",
    "createdAt": 1789707600000,
    "completedAt": 1789710300000,
    "duration": 2700,
    "location": "Home Office",
    "priority": "medium"
  },
  {
    "id": "2b42c68c-fb35-42c2-aadd-18d1bc1db847",
    "title": "Sprint Sync (Day 6)",
    "type": "meeting",
    "createdAt": 1789716600000,
    "completedAt": 1789718400000,
    "duration": 1800,
    "location": "Meeting Room",
    "priority": "medium"
  },
  {
    "id": "826a68be-9ddc-4cfc-a1d2-7112edaf66bb",
    "title": "Draft Technical Proposal (Day 6)",
    "type": "writing",
    "createdAt": 1789725600000,
    "completedAt": null,
    "duration": 270,
    "location": "Cafe",
    "priority": "high"
  },
  {
    "id": "56194ee4-ab69-447a-a3c2-b3f2905b4100",
    "title": "Documentation Updates (Day 6)",
    "type": "writing",
    "createdAt": 1789730100000,
    "completedAt": null,
    "duration": 180,
    "location": "Cafe",
    "priority": "low"
  },
  {
    "id": "9cfd9d37-ea28-4013-852d-05963c619101",
    "title": "Plan Tomorrow Goals (Day 6)",
    "type": "planning",
    "createdAt": 1789734600000,
    "completedAt": 1789735500000,
    "duration": 900,
    "location": "Home Office",
    "priority": "low"
  },
  {
    "id": "89f767bf-8dad-47cb-97f7-301693919d7b",
    "title": "Refactor Data Pipeline (Day 7)",
    "type": "coding",
    "createdAt": 1789789500000,
    "completedAt": 1789793100000,
    "duration": 3600,
    "location": "Home Office",
    "priority": "high"
  },
  {
    "id": "96d9afa2-97d3-4e74-a840-a215ff0cfaa3",
    "title": "Implement Unit Tests (Day 7)",
    "type": "coding",
    "createdAt": 1789794000000,
    "completedAt": 1789796700000,
    "duration": 2700,
    "location": "Home Office",